{"work_id":"ammaiyappan","target_language":"en","scene_id":"ammaiyappan-s055","archival_scene_ordinal":55,"source_scene_number":null,"scene_status":"verified","unit_count":1,"units":[{"id":"ammaiyappan-en-s055-u001","kind":"dialogue","status":"verified","target_language":"en","scene_id":"ammaiyappan-s055","archival_scene_ordinal":55,"source":{"source_path":"works/ammaiyappan/dialogues/records/scene-055.json","canonical_scene_path":"works/ammaiyappan/scenes/scene-055.md","source_record_id":"ammaiyappan-s055-d001","source_occurrence_id":null,"source_locator":null,"speaker_label":"சக்கரவர்த்தி","page_provenance":[{"pdf_page":96,"printed_page":94}],"speaker_label_origin":"source-explicit-colon"},"translation":{"english_text":"Commander Velazhagan... has been killed... a great disgrace to Vengai Nadu! Not only did he desert the army, he also killed the commander... That sinner must not be spared! Hang him at once.","mode":"prose-faithful","notes":["`தூக்கிவிடுங்கள்` is rendered by its immediate punitive sense as `Hang him at once.`"]}}]}